,Quarter,Sentence,PRES,TURN_AT_TALK,CEO,WORDCOUNT,Restatement Topic,FRAUD
405,Q408,"For the last four years, we have added record earnings as well.",1,2,1,12,0,0
406,Q408,"For 2008, we generated revenue of $439.7 million, and earnings of $32.3 million.",1,2,1,13,1,1
407,Q408,"This is an increase in revenue of 14.9% over 2007, and an increase in earnings of 55%.",1,2,1,17,1,1
408,Q408,"This equates earnings per share of $3.46 in 2008, compared to $2.26 last year.",1,2,1,14,1,1
409,Q408,"With that, I will turn this over to Stephanie to review our financial results, focusing on the fourth quarter.",1,2,1,19,0,2
410,Q408,Thank you.,1,4,1,2,0,2
411,Q408,"Obviously we are very pleased to be able to report the record results for 2008, and the very strong fourth quarter which Stephanie has just described.",1,4,1,26,0,0
412,Q408,"As you all know, the economic environment has changed significantly in it the last five months.",1,4,1,16,0,0
413,Q408,"As we look forward to the first quarter of 2009, and beyond, I will focus on the recession, the financial crisis, the changing cost of steel and finally the stimulus plan and how each of these may affect our businesses.",1,4,1,40,0,0
414,Q408,"As of the end of 2008, our backlog was approximately $190 million.",1,4,1,12,1,1
415,Q408,"While this is down from the $235 million we reported at the end of the third quarter, it is still at quite a healthy level.",1,4,1,25,1,1
416,Q408,The change in the backlog was virtually entirely due to the tubular products business.,1,4,1,14,0,0
417,Q408,The water transmission backlog stayed at approximately the same level from Q3 to Q4.,1,4,1,14,0,0
418,Q408,The change in the backlog brings to us a discussion about the recession and its effect on our tubular products group.,1,4,1,21,0,0
419,Q408,"As most of you know, the bulk of our tubular products business is a short-term inventory-type business.",1,4,1,17,1,1
420,Q408,"During 2008, sales of our energy products grew dramatically.",1,4,1,9,0,0
421,Q408,Demand was so high for these products that we began to build a longer term backlog than we would normally expect.,1,4,1,21,0,0
422,Q408,"As the recession hit late in Q3 and early Q4, one of the consequences was the decline in natural gas drilling activity and a decline in order activity for our energy products.",1,4,1,32,0,0
423,Q408,"Throughout the fourth quarter; however, we continue to supply our customers with pipe that they had previously ordered.",1,4,1,18,0,0
424,Q408,"This grew strong results in Q4, even as the demand declines precipitously and resulted in the decline in the backlog at year end.",1,4,1,23,0,0
425,Q408,"In addition to energy products for which the demand is driven by drilling activity, the key drivers for our tubular products growth includes highway spending, non-residential construction, and agricultural spending.",1,4,1,30,0,0
426,Q408,"As we look ahead in this recessionary environment, we expect all of these to be down at least through first half of 2009.",1,4,1,23,0,0
427,Q408,"Accordingly, we are not expecting the same kind of results in 2009, that we are able to generate last year.",1,4,1,20,0,0
428,Q408,"We also believe we are seeing a magnified effect right now, because our customers, primarily distributors, are reducing their own stocks.",1,4,1,21,0,0
429,Q408,"Accordingly, demand for our tubular products is very low.",1,4,1,9,0,0
430,Q408,"Conversely, we expect to a see a somewhat oversized increase in demand later in the year, when inventories need to be restocked at the same time user demand increases.",1,4,1,29,1,1
431,Q408,Steel costs will also be a significant factor in our 2009 results.,1,4,1,12,0,0
432,Q408,"In 2008, steel climbed almost $1,200 per ton for the grades that we use in this business.",1,4,1,17,0,0
433,Q408,Today those same grades of steel are selling for approximately half this amount.,1,4,1,13,0,0
434,Q408,Historically our selling prices have adjusted to changes in steel costs.,1,4,1,11,0,0
435,Q408,"As we look ahead, we expect steel costs will increase this year, though probably only by $150 to $250 per ton.",1,4,1,21,0,0
436,Q408,Accordingly we expect a lower average selling price throughout the year.,1,4,1,11,0,0
437,Q408,"The financial crisis has not altered our business model in tubular products so far, as near as we can tell.",1,4,1,20,0,0
438,Q408,"Certainly some of our customers may be having more difficulty with credit lines and if so, this may reduce the amount of inventory they ultimately will carry as things improve.",1,4,1,30,0,0
439,Q408,"To date, we have not seen any financial difficulties in our customers such as bankruptcies or even dramatic changes in payment patterns and we don't believe there's a very high risk here.",1,4,1,32,0,0
440,Q408,"Drilling activity; however, can be traced to both economic conditions, ie, the recession and the credit crunch.",1,4,1,17,0,0
441,Q408,"This is generally a highly leveraged business and the lack of credit may be exacerbating the slowdown that we currently see, obviously trying to separate the impact of the financial crisis from the recession is difficult.",1,4,1,36,0,0
442,Q408,The stimulus plan could provide some benefits to the tubular products group.,1,4,1,12,0,0
443,Q408,"Obviously, there are dollars in the plan for highway spending and this could filter down into the traffic sign post business.",1,4,1,21,0,0
444,Q408,"Perhaps more importantly, we do make some structural products at our Atchison, Kansas division.",1,4,1,14,0,0
445,Q408,Construction spending may increase demand for these products.,1,4,1,8,0,0
446,Q408,"At this time; however, we do not expect much of the benefit from the stimulus in the tubular products group.",1,4,1,20,0,0
447,Q408,The real boost to this business will come as the natural gas exploration market improves.,1,4,1,15,0,0
448,Q408,We continue to expect improvement in demand for the API products that we currently make.,1,4,1,15,0,0
449,Q408,Obviously gas exploration has not stopped and this country's reliance on natural gas will not end.,1,4,1,16,0,0
450,Q408,The long-term fundamentals in this business are still strong and we have a good position in this market.,1,4,1,18,0,0
451,Q408,"We are also in the process of re-commissioning our plant in Bossier City, Louisiana, and modifying it to focus on OTCG products for natural gas drilling.",1,4,1,26,0,0
452,Q408,"Because we already own the land and buildings and the major manufacturing equipment, we will be able to enter this market on a cost effective basis; however, when we began this project, we certainly planned on higher drilling activity than is currently forecasted.",1,4,1,43,0,0
453,Q408,"In order to minimize our risk and conserve capital, we are not going to finish the plant at this time.",1,4,1,20,0,0
454,Q408,"We will complete the main manufacturing line, but we will not add the downstream operations to finish the products.",1,4,1,19,0,0
455,Q408,This will allow us to access the market by sending products out to a processor for finishing and to rapidly complete the plant when the market conditions warrant.,1,4,1,28,0,0
456,Q408,We believe this strategy will prove to be very effective in maximizing our return on this investment.,1,4,1,17,0,0
457,Q408,"Turning to water transmission, and, again, focusing on the recession, the financial crisis, the cost of steel, and the stimulus package, we see a very different story.",1,4,1,27,0,0
458,Q408,"First of all, as I have said before, the water transmission business does not always run according to a business cycle.",1,4,1,21,1,1
459,Q408,Projects are often planned for many years in advance and are sometimes part of 50 year build out plans.,1,4,1,19,0,0
460,Q408,Near-term issues can certainly delay products but fundamentally this is a business with a very long-term time horizon.,1,4,1,18,0,0
461,Q408,"As we look at the effects of recession, we do not see anything like the impact that we have seen in tubular products.",1,4,1,23,0,0
462,Q408,"In fact, our three-year outlook is actually higher today than it it was six months ago, or a year ago.",1,4,1,20,0,0
463,Q408,"We see a significant number of projects ahead of us, primarily new construction that will provide greater market opportunities in our future than we have seen to date.",1,4,1,28,0,0
464,Q408,There are many concerns about the funding issues for these projects.,1,4,1,11,0,0
465,Q408,The credit crunch or credit freeze has been widely reported but it's important to make distinctions between markets.,1,4,1,18,0,0
466,Q408,"First, there's a common perception that water projects are funded out of tax revenues.",1,4,1,14,0,0
467,Q408,"However, this is not the case.",1,4,1,6,0,0
468,Q408,Water projects are typically by revenue bonds which are backed by connection fees monthly water rates and no tax dollars involved.,1,4,1,21,0,0
469,Q408,The key to funding is the municipal bond market and particularly the revenue bond market.,1,4,1,15,0,0
470,Q408,"After temporarily freezing in October, we see the municipal bond market functioning again today.",1,4,1,14,0,0
471,Q408,"For the first several weeks of this year, bond sales have averaged around $5 million per week and rates have come down as well.",1,4,1,24,0,0
472,Q408,This market looks to be well on its way to recovery.,1,4,1,11,0,0
473,Q408,"To be more specific about funding issues, last quarter, we surveyed many of the municipal agencies that we felt would have significant activity in 2009.",1,4,1,25,0,0
474,Q408,We found that approximately 90% of these agencies had funding in place for upcoming projects or had no concerns about funding.,1,4,1,21,0,0
475,Q408,We have -- we have updated that research in the last four days and generally found the same answers.,1,4,1,19,0,0
476,Q408,For most agencies funding is not the last component to be put in place.,1,4,1,14,0,0
477,Q408,"We believe that in most cases, the projects we will be bidding in 2009 are already funded.",1,4,1,17,0,0
478,Q408,"That being said, we always see delays in the water transmission business.",1,4,1,12,0,0
479,Q408,Nearly half of all projects are delayed from their original planned bid dates for a variety of reasons.,1,4,1,18,0,0
480,Q408,"In the fourth quarter of 2008, we saw well over $100 million worth of projects postponed that we had expected to bid during the quarter.",1,4,1,25,0,0
481,Q408,This obviously affected our backlog at year end.,1,4,1,8,0,0
482,Q408,As we analyzed these postponements we found only one agency that's has postponed work for a significant period of time due to funding issues.,1,4,1,24,0,0
483,Q408,"This particular agency recently adopted an approach that they would get the funding in the last step of developing a project as they saw the municipal bond market freeze up in the fourth quarter and rates go higher, they moved all of their projects out.",1,4,1,45,0,0
484,Q408,The other project delayed out of Q4 generally moved for a variety of reasons having nothing to do with funding.,1,4,1,20,1,1
485,Q408,All of these projects have new expected bid dates within the next six months.,1,4,1,14,0,0
486,Q408,One or two appear to have delayed as they waited clarity on the stimulus package.,1,4,1,15,0,0
487,Q408,"Even though they may have had funding already in place, they wanted to see if a new source of funding might become available.",1,4,1,23,0,0
488,Q408,Now that the stimulus is finalized we hope to see these projects proceed rapidly.,1,4,1,14,0,0
489,Q408,The cost of steel will also have an impact on this business.,1,4,1,12,0,0
490,Q408,As steel costs fell our selling prices adjusted as well.,1,4,1,10,1,1
491,Q408,Steel is not nearly as big of a component of our cost in the water transmission business as it is in tubular products.,1,4,1,23,0,0
492,Q408,And the input cost of selling price relationships is not as tight but raw material price is still an important factor.,1,4,1,21,0,0
493,Q408,Based on our forecast of steel costs we expect our average selling price in 2009 will be lower.,1,4,1,18,0,0
494,Q408,"Finally, the stimulus package.",1,4,1,4,0,0
495,Q408,Obviously this package went through numerous changes before it was finalized and signed by President Obama last week.,1,4,1,18,0,0
496,Q408,There are a few pieces to the package that are significance to us.,1,4,1,13,0,0
497,Q408,"First, the act provides for $6.4 billion, primarily for water infrastructure to be administered by the EPA.",1,4,1,17,0,0
498,Q408,"Of this total, $4 billion is targeted for projects under the Clean Water Act and $2 billion is targeted for projects under the Safe Drinking Water Act, the most important component for us.",1,4,1,33,0,0
499,Q408,"In addition, $1.375 billion was appropriated for rural water programs, $200 million was distributed to the Army Corps of Engineers for water-related projects and the bureau of reclamation also received $1 billion for water projects.",1,4,1,35,0,0
500,Q408,"We are tracking a few large projects that are financed at least in part by either the bureau or the corps and while it is not a significant part of our overall business, we also make piling products and any increase in highway construction may benefit this segment as well.",1,4,1,50,0,0
501,Q408,"In spite of the funding provided in the stimulus package, we are not currently counting on any benefits.",1,4,1,18,0,0
502,Q408,"We do see upside potential, however.",1,4,1,6,0,0
503,Q408,We think the stimulus will tend to accelerate certain projects.,1,4,1,10,0,0
504,Q408,"As noted earlier, we know of some agencies who have postponed major projects waiting for some clarity on the package, based on our review, it appears they may be eligible and will undoubtedly work to get included and this means moving quickly.",1,4,1,42,0,0
505,Q408,We now know of a few other agencies that are planning to move bids from 2010 to 2009 for some specific projects in order to access stimulus funds.,1,4,1,28,0,0
506,Q408,"The act is clear, the projects need to be started soon in order to qualify for funding.",1,4,1,17,0,0
507,Q408,The biggest piece of the package that is applicable to us is the $2 billion for the Safe Drinking Water Act.,1,4,1,21,0,0
508,Q408,This amount will be distributed to states according to a pre-existing formula.,1,4,1,12,0,0
509,Q408,The states will find local projects to qualify and pass the funds through to these projects.,1,4,1,16,0,0
510,Q408,"Importantly the requirements for matching funds has been waived and a certain proportion of these funds may be grants, industry loans or even negative interest loans.",1,4,1,26,0,0
511,Q408,This will be very attractive to local municipalities and it's certainly possible we will see an uptick in near term bidding activities as agencies seek to access this funding source.,1,4,1,30,0,0
512,Q408,"One last point regarding stimulus packages, Canada has also adopted a package and their package they have roughly $10 billion targeted towards construction projects.",1,4,1,24,0,0
513,Q408,We are very well situated to serve western Canada.,1,4,1,9,0,0
514,Q408,"To the extent monies are funneled into water projects in this part of the country, we may also benefit north of the US border.",1,4,1,24,0,0
515,Q408,"So as you attempt to pull all of this together and get a sense of where Northwest Pipe is going in the next year, I would suggest this in summary.",1,4,1,30,0,0
516,Q408,Tubular products will be challenged in the first two quarters of the year.,1,4,1,13,0,0
517,Q408,"Assuming some improvement in the general economy and in drilling activity, will be quite a stronger in the second half.",1,4,1,20,0,0
518,Q408,Per unit pricing will clearly be down as will raw material costs.,1,4,1,12,0,0
519,Q408,We believe the first quarter revenues will likely be off 20 to 30% year-over-year.,1,4,1,14,1,1
520,Q408,"Water transmission revenues in the first quarter will be off somewhat year-over-year, due to the down time caused by the installation of the new mill in Adelanto which was just completed last week and to weather issues.",1,4,1,37,1,1
521,Q408,"Revenues will be somewhat better in the second quarter and quite a bit better in the second half, based on expected bidding activity and the timing of production.",1,4,1,28,1,1
522,Q408,"Benefits from the stimulus package, if any, will not take effect until the third quarter at the earliest and most likely the fourth quarter.",1,4,1,24,0,0
523,Q408,"Because of lower input costs we expect lower selling prices and this will tend to reduce overall water transmission revenues, but should not have a detrimental impact on margins.",1,4,1,29,0,0
524,Q408,"We have made the decision to temporarily close the Pleasant Grove, Utah, facility.",1,4,1,13,0,0
525,Q408,"This division has performed very well since we acquired it and its people are first rate; however, there's simply not enough work locally to maintain the facility.",1,4,1,27,0,0
526,Q408,"We do see jobs coming up in the Utah region, but they are for pipe sizes that are out of our range at this facility.",1,4,1,25,0,0
527,Q408,We hope to see more project activity in the future and the opportunity to reopen this division.,1,4,1,17,0,0
528,Q408,"At this time, we expect to be operating this facility through the end of April.",1,4,1,15,0,0
529,Q408,"Overall, we are adjusting our cost structures in order to react to the changing market conditions we see.",1,4,1,18,0,0
530,Q408,Our objective is to find ways to perform well during these challenging times and be prepared to take advantage of better conditions as the economy improves.,1,4,1,26,0,0
531,Q408,"I'm confident that the long-term drivers of our businesses are strong, and I believe we will come through this economic cycle successfully.",1,4,1,22,0,0
532,Q408,"In conclusion, I'm once again very pleased to be able to report these record results for 2008.",1,4,1,17,0,0
533,Q408,But we certainly have some favorable market conditions during the year.,1,4,1,11,0,0
534,Q408,We also face many challenges and I'm proud of the way our team executed.,1,4,1,14,0,0
535,Q408,I expect to be just as proud of their performance a year from now when we look back at 2009.,1,4,1,20,0,0
536,Q408,At this time we will be happy to answer any questions you may have.,1,4,1,14,0,0
537,Q408,"Yes, I think it will be down a little bit year-over-year, and as we said, the -- the new mill installation (inaudible) is certainly a big part of it.",0,7,1,29,0,0
538,Q408,It carried into 2009.,0,7,1,4,0,0
539,Q408,"We have also had several weather events during 2009 as well, that even though it it didn't seem to be a very extreme winter, it hit at the wrong time and the wrong places.",0,7,1,34,0,0
540,Q408,So we were down for several days because of weather in the first quarter already.,0,7,1,15,0,0
541,Q408,"Well, it's a little bit difficult to do that, because it varies from product to product and as you know we have a variety of different product lines which have different pricing.",0,9,1,32,0,0
542,Q408,"I would say in tubular products, it is historically true that the price does adjust to the changing cost of steel.",0,9,1,21,1,1
543,Q408,"And so steel is down, figure steel down at least $500 a ton in Q1 from where it was at the peak.",0,11,1,22,0,0
544,Q408,"By now, the prices have pretty much adjusted to that number.",0,11,1,11,0,0
545,Q408,"Yes, I think it was really just a better mix of projects going through the plants, because the down time, obviously, tends to reduce your overall margins.",0,15,1,27,0,0
546,Q408,So that was not a bad performance.,0,15,1,7,0,0
547,Q408,"There's some possibilities, Brent. Nothing that I can quantify at this point.",0,17,1,12,0,0
548,Q408,We don't at the current time.,0,19,1,6,0,2
549,Q408,We do expect supply to get a little tighter.,0,19,1,9,0,0
550,Q408,"We do think that we'll see probably some increases, small increases starting in April, and steel costs and we also think we will see lead times start to extend a little bit, somewhere in that time frame.",0,19,1,37,0,0
551,Q408,But at the moment we have no concerns.,0,19,1,8,0,0
552,Q408,"Well, I'm not exactly sure how you want to approach that discussion.",0,25,1,12,0,0
553,Q408,There's the concept of fixed versus variable cost in accounting is not quite the same way it works in reality.,0,25,1,20,1,1
554,Q408,We typically have more what I would call semi-fixed costs within our range of production.,0,25,1,15,0,0
555,Q408,"And as we'll adjust, our production, what we will try to do is stay at the right end of that range, if you will.",0,25,1,24,0,0
556,Q408,And that generally means looking at shifts as opposed to smaller changes in terms of staffing levels.,0,27,1,17,0,0
557,Q408,"For example, in our Atchison plant, we have two shifts today, where we were at three shifts a few months ago.",0,27,1,21,0,0
558,Q408,"The true fixed costs in this business, you can -- are not as great as you might expect and I don't have the numbers in front of me, Brian, but we can go through that in more detail.",0,27,1,38,1,1
559,Q408,"We think we are going to adjust reasonably effectively, but, yes, there are some fixed costs and it will be hard to leverage against the fixed costs with lower volumes.",0,29,1,30,0,0
560,Q408,"There will be some negative impact, but we should be able to adjust pretty efficiently.",0,29,1,15,0,0
561,Q408,"Yes. At least in the first half, there's a possibility.",0,31,1,10,0,0
562,Q408,We do see some reductions in costs there as well.,0,31,1,10,0,0
563,Q408,Obviously we are doing the same types of things that many people are in order to manage our costs better.,0,31,1,20,1,1
564,Q408,"So we're aiming at not seeing that go up, but as we look at this year, as you have just implied, we see a very -- a significant difference between the first half and the second half.",0,31,1,37,0,0
565,Q408,And so first half might be a little more challenging.,0,31,1,10,0,0
566,Q408,"Well, there is-- there was a successful trade case that affects API pipe, and that is in place as well as other products.",0,33,1,23,0,0
567,Q408,There is a proposed case on OCTG products but I really don't have any other details about that at this point in time.,0,33,1,23,0,0
568,Q408,I will say that there was a significant amount of OCTG products that came into the country in the last -- in the last couple of months.,0,33,1,27,0,0
569,Q408,So there is a significant amount of pipe on the ground or in the ports right now.,0,33,1,17,0,0
570,Q408,That kind of -- that thought process is certainly based in -- on sound logic.,0,35,1,15,0,0
571,Q408,"And there are efforts underway, but whether or not those will be successful at this point, I can't tell you.",0,35,1,20,0,0
572,Q408,"Well, I'm thinking about the way that question is phrased.",0,37,1,10,0,0
573,Q408,"There's always an answer to that, because it's open ended.",0,37,1,10,0,0
574,Q408,"Rather than respond to that, let me tell you in terms of what we've looked at as to what we think are the likely scenarios that lay out over the next 12 months, we feel like we are in pretty good shape.",0,37,1,42,0,0
575,Q408,"As our business slows down, obviously, let's take the negative scenario where water transmission does not do as well as we think, our balance sheet tends to start to kick out a lot of cash.",0,37,1,35,0,0
576,Q408,So our balance sheet picture gets a lot better as that business slows down.,0,37,1,14,1,1
577,Q408,It's almost more challenging if that business does better than we expect in order to have the capability to continue to finance it.,0,37,1,23,0,0
578,Q408,But we have a significant amount of capacity available as we speak today.,0,37,1,13,0,0
579,Q408,So we do not see the scenario that really gets us into trouble as being very realistic.,0,37,1,17,0,0
580,Q408,"Now, if the recession carries on for years, obviously we and everybody else will have some problems, but as we've looked at the various scenarios that we think are likely, we have not been concerned about the financing.",0,37,1,38,0,0
581,Q408,I think the answer to that is probably yes.,0,41,1,9,0,0
582,Q408,I don't think it's necessarily across the board.,0,41,1,8,0,0
583,Q408,"The -- in terms of size ranges and so on, but I couldn't give you a lot of details regarding that.",0,41,1,21,0,0
584,Q408,"OCTG products, oil country tubular goods is where the most recent surge has come from.",0,41,1,15,0,0
585,Q408,"And that is essentially what the -- if you are not familiar with that terminology, that's essentially -- think of it as down hole type products, the verticals in gas or oil exploration.",0,41,1,33,0,0
586,Q408,"There are different people? -- did I use the term ""glut"" in the press release? I've got to go back and look.",0,43,1,22,0,0
587,Q408,"There are different analysts who are far more attuned to that overall industry than I am, and they have estimates out there, some of them six months supply, some of them 10 months supply.",0,45,1,34,0,0
588,Q408,"It's probably somewhere in that range and, of course, as I said, I don't believe it's across the board.",0,45,1,19,0,0
589,Q408,I think it will be higher in some sizes than others.,0,45,1,11,0,0
590,Q408,Yes.,0,50,1,1,0,2
591,Q109,"Thank you, Sarah.",1,4,1,3,0,2
592,Q109,Welcome to Northwest Pipe's conference call and the announcement of earnings for the first quarter of 2009.,1,4,1,17,0,2
593,Q109,My name is Brian Dunham I am the President and CEO of the company.,1,4,1,14,0,2
594,Q109,"I am joined by Stephanie Welty, our Chief Financial Officer.",1,4,1,10,0,2
595,Q109,"Before we begin, I would like to remind everyone that the statements we make in this call about our expectations for the future are forward-looking statements and actual results could differ materially.",1,4,1,32,0,2
