,Quarter,Sentence,PRES,TURN_AT_TALK,CEO,WORDCOUNT,Restatement Topic,FRAUD
196,Q108,"The other driver has been for the last few years, talked about extensively is the placement markets, the Asian infrastructure that is crumbling underground and needs to be replaced, that market is (technical difficulty) there.",0,9,1,35,0,0
197,Q108,"However, still a relatively small part of the total market opportunity that we see.",0,9,1,14,0,0
198,Q108,We do think that's going to be increasing over time though.,0,9,1,11,0,0
199,Q108,"As we look ahead here over the next several years, we will see a greater component replacement market come into play to go along with these longer pipelines that we think of as new construction.",0,9,1,35,0,0
200,Q108,"No, this is what's on the radar. Obviously we've already booked some things here in April, but no, this is, as we expect to see jobs bid in the second quarter.",0,19,1,31,0,0
201,Q108,If look at the year at the beginning of the year and today it hasn't changed much.,0,19,1,17,0,0
202,Q108,Q2 and Q3 were clearly targeted as the strongest quarters for bidding activity.,0,19,1,13,0,0
203,Q108,"And then of course, our revenue stream tends to follow that by somewhere in the neighborhood of three to six months depending on how these jobs lay out because there is leadtimes between bidding the job and starting to produce the orders.",0,19,1,42,1,1
204,Q108,"Yes, some of it was certainly the availability of steel because we lost a little bit there as leadtimes extended, but some of it was just the way the jobs laid out during the quarter at our various facilities.",0,21,1,39,1,1
205,Q108,"So the backlog, as I think I said last time, the backlog never is perfect.",0,21,1,15,1,1
206,Q108,It's never even across the country.,0,21,1,6,0,0
207,Q108,So you don't always have all your facilities operating at high levels even if you have a strong backlog.,0,21,1,19,1,1
208,Q108,"So in this case, we had a little bit of holes here and there around the country, and so we didn't generate the type of revenue that we think we can as we go forward.",0,21,1,35,1,1
209,Q108,"I think generally I would say without getting real specific, I think the activity is pretty strong throughout the country.",0,23,1,20,0,0
210,Q108,"It's probably weakest in the East, which is not unusual.",0,23,1,10,0,0
211,Q108,It may be strongest in the Midwest right now.,0,23,1,9,0,0
212,Q108,"But we continue to see, particularly in the Southwest corridor, we continue to see that market improving as we go forward.",0,23,1,21,0,0
213,Q108,Our product in energy is primarily gas gathering lines.,0,27,1,9,0,0
214,Q108,"That market continues to be pretty strong, and we think it's going to be pretty strong going forward.",0,29,1,18,0,0
215,Q108,None of our stuff is really going down [all]; it's not oil country.,0,29,1,13,0,0
216,Q108,Yes. We think order trends certainly have been accelerating.,0,31,1,9,0,0
217,Q108,I don't have it right in front of me.,0,33,1,9,0,2
218,Q108,I'm looking to see if I do.,0,33,1,7,0,2
219,Q108,"I don't think I have it, but I don't think it was a very big amount this year.",0,33,1,18,0,2
220,Q108,"If we weren't comfortable, I guess we would know the number off the top of our head.",0,36,1,17,1,1
221,Q108,"No. There's delays all the time, as you know, as we've talked before, for a variety of reasons.",0,40,1,18,1,1
222,Q108,But I can't think of any project that would be specifically tied to either of those issues.,0,40,1,17,0,0
223,Q108,I think the impact was relatively light in terms of overall volume.,0,42,1,12,0,0
224,Q108,I would guess it was probably less than 5%.,0,42,1,9,0,0
225,Q108,Certainly less than 5% of the total volume.,0,42,1,8,0,0
226,Q108,"The margin was probably -- was certainly lower, so it certainly dragged down the overall margin a little bit, but not very significantly.",0,42,1,23,0,0
227,Q108,The Water margin has been improving as we've worked through some things internally in terms of our own capacity and our efficiency in our plants.,0,44,1,25,1,1
228,Q108,"It certainly improves some with higher volume going through, and if you go back, getting into the 60s is not the highest volume we've ever had, but it's getting to a reasonable level.",0,44,1,33,1,1
229,Q108,I think we will see the margin improve a little bit more as we get into the '70s with a little bit more leverage against fixed costs.,0,44,1,27,0,0
230,Q108,But we are about where I thought we would be.,0,44,1,10,0,0
231,Q108,"We talked about this, in 2006 when we went out and did the public offering, we talked about the possibility of 300 basis points improvement, and we are about there.",0,44,1,30,1,1
232,Q108,"A component of that, remember, Rob, was price increases.",0,44,1,9,1,1
233,Q108,And we certainly did see prices get better in Q4.,0,44,1,10,1,1
234,Q108,"They got a little bit better in Q3 last year, then they got better in Q4.",0,44,1,16,1,1
235,Q108,So we're seeing a little bit of that rolling through now.,0,44,1,11,0,0
236,Q108,"And we should see that, I hope, as we go ahead here into the next quarter.",0,44,1,16,0,0
237,Q108,"But I don't think we're going to see it be -- going up dramatically from here, at least until we see another round maybe of pricing getting a little bit better.",0,44,1,31,0,0
238,Q108,"Yes, in Texas, there are several projects.",0,46,1,7,0,0
239,Q108,I don't really have any specific updates on any of those right now.,0,46,1,13,1,1
240,Q108,"Some of the bigger ones are still out there and still I don't think we have bid dates that are certain, at least not in the next several months.",0,46,1,29,1,1
241,Q108,"The Nevada project, as it was about a month ago, not a lot has changed.",0,46,1,15,0,0
242,Q108,They have -- we understand that there is a draft specification.,0,46,1,11,0,0
243,Q108,But it has not yet been released to industry.,0,46,1,9,0,0
244,Q108,"It's still undergoing internal review at the agency, so we have yet to see what that specification looks like.",0,46,1,19,0,0
245,Q108,"There certainly have been discussion about some of the key factors, one of which is that it will be 100 miles of pipe is going to be in the first bid.",0,46,1,31,0,0
246,Q108,"But other than that, we don't really know anything different.",0,46,1,10,0,0
247,Q108,We hope to see that within the next couple of weeks.,0,46,1,11,0,0
248,Q108,"But I think we hoped to see it within about two weeks a month ago, as well.",0,46,1,17,0,0
249,Q108,So we just have to wait until they get it out to us and go from there.,0,46,1,17,0,0
250,Q108,"The longer it goes, the more difficult that assumption becomes.",0,48,1,10,0,0
251,Q108,"So if they get it out quickly, if they want to move quickly on it, they can certainly still bid it in 2008.",0,48,1,23,0,0
252,Q108,But we'll have to wait and see when it comes out.,0,48,1,11,0,0
253,Q108,I wouldn't say there aren't any in Texas because there certainly are some.,0,50,1,13,0,0
254,Q108,"And, as far as southern Nevada goes, we still hope to see it bid this year.",0,52,1,16,0,0
255,Q108,But we think the market is going to be pretty strong even if it postpones until next year.,0,52,1,18,0,0
256,Q108,"No, we're not.",0,56,1,3,0,2
257,Q108,"Yes, that's exactly our view.",0,58,1,5,0,2
258,Q108,"We think, if anything, there's a bit of a glut of refinancings that have to be sorted through.",0,58,1,18,1,1
259,Q108,And so (technical difficulty) be a little bit extra bonds out there that need to be absorbed kind of into the system.,0,58,1,22,0,0
260,Q108,So it might slow down a couple of things.,0,58,1,9,0,0
261,Q108,But we don't see any major issue with that or long-term issue with that.,0,58,1,14,0,0
262,Q308,"Thank you, Heather.",1,2,1,3,0,2
263,Q308,Welcome to Northwest Pipe's conference call and the announcement of earnings for the third quarter of 2008.,1,2,1,17,0,2
264,Q308,"My name is Brian Dunham. I'm the President and CEO of the Company. I am joined by Stephanie Welty, our Chief Financial Officer.",1,2,1,23,0,2
265,Q308,"Before we begin, I would like to remind everyone that the statements we make in this call about our expectations for the future are forward-looking statements, and actual results could differ materially.",1,2,1,32,0,2
266,Q308,Please refer to our most recent filing with the SEC for a discussion of risk factors that could cause actual results to differ materially.,1,2,1,24,0,2
267,Q308,"With that, I will turn this over to Stephanie to review our financial results.",1,2,1,14,0,2
268,Q308,Thank you.,1,4,1,2,0,2
269,Q308,"As we look ahead to the fourth quarter, we continue to expect good results.",1,4,1,14,0,0
270,Q308,"Bidding activity in the third quarter was lower than expected, due to project delays, and as a result, our backlog is at $235 million.",1,4,1,24,1,1
271,Q308,"This is still a good level, although it is down from last quarter.",1,4,1,13,0,0
272,Q308,The good news is that many of the bids that delayed in Q3 simply moved into the fourth quarter.,1,4,1,19,1,1
273,Q308,"Consequently, we expect a stronger bookings quarter in Q4, and we should see backlog grow between now and the end of the year, putting us in a very good position for 2009.",1,4,1,32,1,1
274,Q308,"As we look at the Water Transmission Group in the fourth quarter, we expect to see a decline in revenue for three reasons.",1,4,1,23,0,0
275,Q308,"First, as you know, we generally expect a slower fourth quarter due to holidays and weather considerations.",1,4,1,17,0,0
276,Q308,"Secondly, we have two new mills that are waiting installation.",1,4,1,10,0,0
277,Q308,"The first mill will be installed in the fourth quarter in our Adelanto, California facility.",1,4,1,15,0,0
278,Q308,"We hope to avoid any significant disruption, but the installation will certainly reduce our revenues out of this facility somewhat during the quarter.",1,4,1,23,0,0
279,Q308,"Finally, we have seen a significant project postponement that we had planned to produce in Q4.",1,4,1,16,1,1
280,Q308,"This project was postponed after the bid, because the City felt the demand was not immediate and the project could be safely postponed, saving money and helping to keep their credit rating high.",1,4,1,33,0,0
281,Q308,The late postponement makes it unlikely that we can fill this manufacturing time with other projects.,1,4,1,16,0,0
282,Q308,The combination of these three factors will clearly result in lower revenues in Q4.,1,4,1,14,0,0
283,Q308,"In the Tubular Products Group, we are expecting another strong quarter in Q4, due primarily to energy sales, which we hope will offset weakness in some of our other markets.",1,4,1,30,0,0
284,Q308,"As we view the markets today, energy is still very strong and pricing remains high.",1,4,1,15,0,0
285,Q308,"We may see some improvement in agricultural products as well, though it's too early to tell.",1,4,1,16,0,0
286,Q308,"However, many of our other products are used in structural or construction applications, and these markets are very slow at this time.",1,4,1,22,0,0
287,Q308,Steel prices have also begun to fall.,1,4,1,7,0,0
288,Q308,"To the extent this leads to lower selling prices, we are unlikely to maintain our current margins.",1,4,1,17,1,1
289,Q308,"Again, as long as energy continues to be as active as it is now, we should generate solid result in spite of the weakness in some of these other areas.",1,4,1,30,1,1
290,Q308,"As previously announced, we are moving forward with plans to start up a facility to serve the oil country tubular goods casing market.",1,4,1,23,0,0
291,Q308,"We have studied our options and have determined that the best course of action is to locate the operations in our Bossier City, Louisiana facility, which has not been operating, as opposed to building a greenfield facility in the Houston area.",1,4,1,41,0,0
292,Q308,This will allow us to bring up production faster at a lower construction cost and with some operational cost savings as well.,1,4,1,22,0,0
293,Q308,We plan to be in production with this facility by the middle of 2009.,1,4,1,14,0,0
294,Q308,"As we look further ahead in the Water Transmission market, the most obvious concern is financing.",1,4,1,16,0,0
295,Q308,Credit markets are in disarray; municipal bond activity is very low today.,1,4,1,12,0,0
296,Q308,"However, with the exception of the project discussed earlier, we do not yet see an impact on our business.",1,4,1,19,1,1
297,Q308,"We have talked with many of the municipalities with major projects scheduled for 2009, and find that most of them already have financing in place or have few concerns about obtaining financing.",1,4,1,32,0,0
298,Q308,"At this time, it appears the one job that was postponed was due to unusual circumstances.",1,4,1,16,0,0
299,Q308,"We are continuing to forecast 2009 to be a record year for bidding activity, although the ultimate size of that market will be dependent on the timing of a few major projects.",1,4,1,32,0,0
300,Q308,"Obviously, we will continue to watch developments on the financing side.",1,4,1,11,0,0
301,Q308,"General economic conditions today are also challenging, and generally impact our Tubular Products Group more than our Water Transmission Group.",1,4,1,20,0,0
302,Q308,"As discussed earlier, we have already seen some of our Tubular Products markets slow down.",1,4,1,15,0,0
303,Q308,"As we look ahead to 2009, we expect generally lower demand for most of our products until the economic conditions improve.",1,4,1,21,1,1
304,Q308,"However, we continue to see strong opportunities for energy pipe.",1,4,1,10,0,0
305,Q308,"While we believe drilling activity will likely be lower, we think there will still be adequate demand for us to generate solid results for the Tubular Products Group as a whole.",1,4,1,31,0,0
306,Q308,"In conclusion, we are pleased to report these record results for the quarter.",1,4,1,13,0,0
307,Q308,"Obviously, at this point, as we look ahead to the end of the year, we expect to set new records in sales and earnings for 2008 as well.",1,4,1,28,0,0
308,Q308,And this will be our fourth consecutive record year.,1,4,1,9,0,0
309,Q308,"At this time, we will be happy to answer any questions you may have.",1,4,1,14,0,2
310,Q308,"Sure. We obviously -- we make a lot of different products for different markets, so it's very difficult to come up with sort of an average price.",0,3,1,27,1,1
311,Q308,"But in general terms, steel is by far our biggest cost in terms of our finished product costing.",0,3,1,18,0,0
312,Q308,And our prices tend to travel along the same route as steel costs go.,0,3,1,14,0,0
313,Q308,"So as steel is going up, as long as the market conditions are strong, we'll certainly be trying to raise our prices to offset that increased cost.",0,3,1,27,0,0
314,Q308,"And that certainly has happened during the first part of this year, first nine months of this year.",0,3,1,18,1,1
315,Q308,"Steel topped out sometime around August, maybe early September.",0,3,1,9,0,0
316,Q308,And we are now seeing steel decline.,0,3,1,7,0,0
317,Q308,"And again, as steel falls, it's likely that our selling prices will come down somewhat as our raw material input costs go down.",0,3,1,23,0,0
318,Q308,There's certainly a lag.,0,3,1,4,0,0
319,Q308,"The Tubular Products business is an inventoriable business, so we probably have about three months worth of inventory on hand.",0,3,1,20,1,1
320,Q308,And so you'll see a lag before those factors are built into new pricing.,0,3,1,14,0,0
321,Q308,"No, I have no way -- I don't know how to tell you what pricing is.",0,5,1,16,1,1
322,Q308,We make 120 different products.,0,5,1,5,0,0
323,Q308,"Oh, I see -- yes, it was both.",0,7,1,8,0,2
324,Q308,"I don't have that exact breakdown, but it was both volume and price.",0,7,1,13,0,2
325,Q308,"And in some cases, that price -- I'll tell you one other piece -- because there's the ever-present product mix.",0,7,1,20,0,0
326,Q308,"And as our mix shifted more to energy, that impacted our average pricing as well.",0,7,1,15,0,0
327,Q308,"I don't think we're going to identify it specifically by name, but it was a major project.",0,13,1,17,0,0
328,Q308,"And it was pushed back, I think, for a couple of different reasons.",0,13,1,13,0,0
329,Q308,"One -- I do think that the financial situation had an impact, although the financing -- my understanding is that the financing for this project was in-hand.",0,13,1,27,0,0
330,Q308,"But I think the agency was -- seeing an opportunity to postpone this because they had reevaluated their requirements for when they needed the water to be delivered, and moved those requirements out.",0,13,1,33,0,0
331,Q308,"So they saw an opportunity where they could postpone this and kind of keep the dry powder, which obviously makes their balance sheet look better going forward.",0,13,1,27,0,0
332,Q308,And they did have future bonding requirements for other projects.,0,13,1,10,0,0
333,Q308,And I think they wanted to show as strong a financial position as they could before they got to that.,0,13,1,20,0,0
334,Q308,"Oh, yes. It's in the Midwest.",0,15,1,6,0,2
335,Q308,"Well, it was more interesting the way you said. Because I think I didn't say no in there; I said most of the municipalities have -- already have the financing in-hand for the projects that they have planned for 2009.",0,17,1,40,0,0
336,Q308,And these are projects that are to bid in 2009; these are not projects that are in our backlog.,0,17,1,19,1,1
337,Q308,"The ones in our backlog, financing is in-hand as well.",0,17,1,10,1,1
338,Q308,"So, we feel pretty good about the backlog, in spite of this one job with a very late postponement. That's pretty unusual.",0,17,1,22,1,1
339,Q308,But we feel pretty good about that.,0,17,1,7,0,0
340,Q308,"And we feel pretty good about the jobs that are currently scheduled for 2009, because the financing is generally in-hand.",0,17,1,20,1,1
341,Q308,"Now, not all of them are in that position.",0,17,1,9,0,0
342,Q308,"There are certainly some agencies that say, look, we have to sell bonds for this and the state of the bond market is going to matter.",0,17,1,26,0,0
343,Q308,But the vast majority of them had the financing in-hand.,0,17,1,10,0,0
344,Q308,"Well, we're -- there's a few different points in there and let me try and address all of them.",0,22,1,19,0,0
345,Q308,"First of all, in terms of overall bidding activity in our markets, we have not noticed what I would think of as any kind of a sea change in either the level of activity or the competitiveness.",0,22,1,37,0,0
346,Q308,It's always competitive in our business and it continues to be.,0,22,1,11,0,0
347,Q308,"We have noticed maybe some instances where competitors might be a little bit more aggressive, which we think is based on their own backlogs and so on, but nothing that I think is terribly significant at this point in time.",0,22,1,40,0,0
348,Q308,"I said earlier, and we just re-addressed in the last question, that we think 2009 will be a record year.",0,22,1,20,0,0
349,Q308,We think that will be building on a record year in 2008 as well.,0,22,1,14,0,0
350,Q308,So we continue to see 2008 as being a new record and we continue to believe that 2009 will be at least slightly better than 2008.,0,22,1,26,0,0
351,Q308,"The other piece -- a point I'll make on that is, I also mentioned that there's some timing of some major jobs in 2009 that obviously could impact it.",0,22,1,29,1,1
352,Q308,"Just to be very clear, we are taking a conservative look at the timing of those jobs and still think 2009 will be slightly better than 2008.",0,22,1,27,1,1
353,Q308,"So, it is a good-looking environment for us, right now, today.",0,22,1,11,0,0
354,Q308,"The financing issue obviously could be a problem, if you believe that there will not be municipal bonds sold in this country over the next year.",0,22,1,26,0,0
355,Q308,"At some point, that's going to be a problem.",0,22,1,9,0,0
356,Q308,"It probably won't be a significant problem based on the research we've done in 2009, but obviously that would catch us at some point.",0,22,1,24,1,1
357,Q308,So I guess you have to make a call on what you think the overall opportunity is for municipal bonds in the long-term.,0,22,1,23,1,1
358,Q308,"Now, to get back to the margin point, the margin on projects that we produced in the third quarter would be based largely on work that was probably bid, Ryan, in maybe the first quarter or early second quarter.",0,22,1,39,1,1
359,Q308,"Because remember, there's a lag time before we get these things into the revenue stream.",0,22,1,15,0,0
360,Q308,"So, I would tell you that I don't see any sort of late-breaking issues there with pricing causing any margin compression.",0,22,1,21,1,1
361,Q308,"I do see -- it's a bit of a mix issue, without a doubt.",0,22,1,14,0,0
362,Q308,And it's partially due to -- a significant portion of it is due to higher raw material costs.,0,22,1,18,0,0
363,Q308,"And even if we pass that cost on, as you know, the higher raw material gets, the lower your margin gets, because you're basically increasing both the numerator and the denominator in that equation.",0,22,1,34,0,0
364,Q308,"And so, we saw some squeeze there during the quarter as well.",0,22,1,12,0,0
365,Q308,So I think those were the primary issues.,0,22,1,8,0,0
366,Q308,I think we will be able to achieve both of those.,0,27,1,11,0,0
367,Q308,"Last year, Water Transmission revenues in the fourth quarter I think was probably our all-time high.",0,29,1,16,0,0
368,Q308,"We will not be between $80 million and $77 million, I will guarantee you. We will definitely be lower than that.",0,31,1,21,0,0
369,Q308,"The job that we were talking about that postponed -- and I don't know if I said this earlier, but that job was in excess of $10 million.",0,31,1,28,0,0
370,Q308,And we see nothing that will fill that slot in the fourth quarter.,0,31,1,13,0,0
371,Q308,"Well, there's a lag on that as well.",0,35,1,8,0,0
372,Q308,"But typically, we bid Water Transmission contracts as fixed price contracts.",0,35,1,11,0,0
373,Q308,"And it does happen, if steel -- it comes down quickly, we sometimes have an opportunity to buy the steel at a lower cost than we had originally bid in the job.",0,35,1,32,0,0
374,Q308,So that can account for some expansion.,0,35,1,7,0,0
375,Q308,"No, but that's a good point.",0,37,1,6,0,2
376,Q308,"The mills have certainly cut back, taken some supply out of the market.",0,37,1,13,0,0
377,Q308,So they're sort of taking advantage of a little bit slower period in the market to do some of the maintenance that they need to do on their mills.,0,37,1,29,0,0
378,Q308,"And that has kept steel, I think, at a little bit higher price than if they were flooding the market with it.",0,37,1,22,0,0
379,Q308,But we haven't seen any issues with availability.,0,37,1,8,0,0
380,Q308,"We break it down in a variety of different ways, but if you kind of group it, as energy as its own separate group -- and as I said, we see that as being still very positive, even though we do expect to see drilling activity decline some in 2009, but we still think there's going to be strong demand for energy.",0,41,1,62,0,0
381,Q308,"Ag separately, there's typically a seasonal downturn in ag products at this point in time.",0,41,1,15,0,0
382,Q308,And we've certainly see a downturn.,0,41,1,6,1,1
383,Q308,There are many people who are speculating that there is more going on there than seasonality.,0,41,1,16,0,0
384,Q308,We think it's just a little bit too early to tell.,0,41,1,11,0,0
385,Q308,"So, we're waiting to see if ag gets a little bit better here over the next couple of months.",0,41,1,19,0,0
386,Q308,"But right now, it has certainly slowed down.",0,41,1,8,0,0
387,Q308,"Again, as I say, it usually slows down at this time.",0,41,1,11,0,0
388,Q308,Farm economy was at an all-time high in '08; I don't think anybody expects it to be that good in 2009.,0,41,1,21,0,0
389,Q308,But it's a question of where it will really settle out and how the farmers will project their own needs in terms of buying new equipment.,0,41,1,26,0,0
390,Q308,"So, it remains to be seen.",0,41,1,6,0,0
391,Q308,The other products you can sort of loosely group in construction-related or structure-related applications.,0,41,1,14,0,0
392,Q308,"And the main one there for us is the fire protection sprinkler-pipe that we make, that gets installed into new construction, primarily, you know, large construction -- schools, warehouses and so on -- you know, office buildings and so on.",0,41,1,40,0,0
393,Q308,And those markets are very slow right now.,0,41,1,8,0,0
394,Q308,The last one I'd say is traffic business.,0,41,1,8,0,0
395,Q308,Traffic business seems to be doing okay.,0,41,1,7,0,0
396,Q308,"But certainly the products that tend to go into construction applications are very, very slow.",0,41,1,15,0,0
397,Q308,"Well, I hate to end the phone call on the words -- very, very slow -- so, I'll just reiterate this was a great quarter for us.",0,45,1,27,0,0
398,Q308,"And we do expect to set a new record for 2008 and hopefully, we'll see good performance in 2009 as well.",0,45,1,21,0,0
399,Q408,"Thank you, Corey.",1,2,1,3,0,2
400,Q408,"My name is Brian Dunham, I'm the President and the CEO of the Company, I'm joined by Stephanie Welty, our Chief Financial Officer.",1,2,1,23,0,2
401,Q408,"Before we begin, I would like to remind everyone that the statements we make in this call about our expectations for the future are forward-looking statements. And actual results could differ materially.",1,2,1,32,0,2
402,Q408,Please refer to our most recent filing with the SEC for a discussion of the risk factors that could cause actual results to differ materially.,1,2,1,25,0,0
403,Q408,I'm pleased to announce record sales and record earnings for 2008.,1,2,1,11,0,0
404,Q408,This is the fifth consecutive year that we have generated record sales.,1,2,1,12,0,0
